{
  "schemaVersion": "1.1.0",
  "auditSchemaMajor": 1,
  "policy": {
    "schemaVersion": "1.0",
    "digest": "0000000000000000000000000000000000000000000000000000000000000000"
  },
  "report": {
    "schemaVersion": "1.0.0",
    "generatedAt": "2026-10-14T12:00:00+00:00",
    "audit": {
      "mode": "read-only",
      "toolVersion": "1.2.0"
    },
    "host": {
      "name": "SYNTHETIC-WORKSTATION",
      "platform": "windows",
      "architecture": "x64"
    }
  },
  "summary": {
    "actionCount": 8,
    "lowRiskCount": 5,
    "mediumRiskCount": 2,
    "highRiskCount": 1,
    "reversibleCount": 2,
    "manualCount": 3
  },
  "actions": [
    {
      "order": 1,
      "actionId": "choco-upgrade:python314",
      "kind": "upgrade",
      "source": {
        "type": "chocolatey",
        "policyKey": null
      },
      "componentId": null,
      "subjectId": "choco:python314",
      "title": "Upgrade python314 (Chocolatey)",
      "currentVersion": "3.14.2",
      "targetVersion": "3.14.8",
      "command": "choco upgrade python314 -y",
      "risk": "low",
      "reversible": false,
      "message": "Chocolatey reports a newer version. Chocolatey upgrades need an elevated (administrator) shell.",
      "evidence": [
        {
          "providerId": "chocolatey.baseline",
          "componentId": "chocolatey",
          "evidenceId": "chocolatey.outdated.normalized"
        }
      ]
    },
    {
      "order": 2,
      "actionId": "npm-global-upgrade:zcatalyst-cli",
      "kind": "upgrade",
      "source": {
        "type": "npm-registry",
        "policyKey": null
      },
      "componentId": "zoho-catalyst-cli",
      "subjectId": "npm:zcatalyst-cli",
      "title": "Upgrade the zcatalyst-cli CLI",
      "currentVersion": "1.27.2",
      "targetVersion": "1.28.0",
      "command": "pnpm add -g zcatalyst-cli@1.28.0",
      "risk": "low",
      "reversible": false,
      "message": "The npm registry reports a newer zcatalyst-cli, installed globally with pnpm.",
      "evidence": [
        {
          "providerId": "javascript.toolchain",
          "componentId": "zoho-catalyst-cli",
          "evidenceId": "javascript.version-intelligence.global.zcatalyst-cli"
        }
      ]
    },
    {
      "order": 3,
      "actionId": "policy:android.preferAndroidHome",
      "kind": "configure",
      "source": {
        "type": "policy",
        "policyKey": "android.preferAndroidHome"
      },
      "componentId": "android-sdk",
      "subjectId": null,
      "title": "Set ANDROID_HOME to the Android SDK folder",
      "currentVersion": null,
      "targetVersion": null,
      "command": null,
      "risk": "low",
      "reversible": true,
      "message": "Set the user variable ANDROID_HOME to the installed Android SDK folder.",
      "evidence": [
        {
          "providerId": "environment.baseline",
          "componentId": null,
          "evidenceId": "environment.android_home"
        }
      ]
    },
    {
      "order": 4,
      "actionId": "policy:path.allowMissingEntries",
      "kind": "cleanup",
      "source": {
        "type": "policy",
        "policyKey": "path.allowMissingEntries"
      },
      "componentId": null,
      "subjectId": null,
      "title": "Remove 3 missing PATH entries",
      "currentVersion": null,
      "targetVersion": null,
      "command": null,
      "risk": "low",
      "reversible": true,
      "message": "The audit report lists which PATH entries no longer exist; remove them from the persistent PATH.",
      "evidence": [
        {
          "providerId": "environment.baseline",
          "componentId": null,
          "evidenceId": "path.user.health"
        }
      ]
    },
    {
      "order": 5,
      "actionId": "winget-upgrade:Git.Git",
      "kind": "upgrade",
      "source": {
        "type": "winget",
        "policyKey": null
      },
      "componentId": null,
      "subjectId": "winget:Git.Git",
      "title": "Upgrade Git",
      "currentVersion": "2.51.0",
      "targetVersion": "2.52.0",
      "command": "winget upgrade --id Git.Git --exact",
      "risk": "low",
      "reversible": false,
      "message": "WinGet reports a newer version.",
      "evidence": [
        {
          "providerId": "winget.baseline",
          "componentId": "winget",
          "evidenceId": "winget.upgrades.normalized"
        }
      ]
    },
    {
      "order": 6,
      "actionId": "policy:node.defaultTrack",
      "kind": "upgrade",
      "source": {
        "type": "policy",
        "policyKey": "node.defaultTrack"
      },
      "componentId": "node",
      "subjectId": null,
      "title": "Upgrade Node.js to the latest LTS",
      "currentVersion": "24.13.0",
      "targetVersion": "24.21.0",
      "command": "winget upgrade --id OpenJS.NodeJS.LTS --exact",
      "risk": "medium",
      "reversible": false,
      "message": "Node is behind the latest LTS release; projects should be retested after the upgrade.",
      "evidence": [
        {
          "providerId": "javascript.toolchain",
          "componentId": "node",
          "evidenceId": null
        }
      ]
    },
    {
      "order": 7,
      "actionId": "wsl-update:wsl",
      "kind": "upgrade",
      "source": {
        "type": "wsl",
        "policyKey": null
      },
      "componentId": "wsl",
      "subjectId": null,
      "title": "Update the Windows Subsystem for Linux",
      "currentVersion": "2.5.7.0",
      "targetVersion": "3.0.3",
      "command": "wsl --update",
      "risk": "medium",
      "reversible": false,
      "message": "A newer WSL release is available. Running distributions are shut down while WSL updates.",
      "evidence": [
        {
          "providerId": "wsl.baseline",
          "componentId": "wsl",
          "evidenceId": null
        }
      ]
    },
    {
      "order": 8,
      "actionId": "policy:node.manager",
      "kind": "install",
      "source": {
        "type": "policy",
        "policyKey": "node.manager"
      },
      "componentId": "nvm-windows",
      "subjectId": null,
      "title": "Migrate Node.js to nvm-windows",
      "currentVersion": null,
      "targetVersion": null,
      "command": null,
      "risk": "high",
      "reversible": false,
      "message": "Requires removing the standalone Node installation first; follow the nvm-windows migration steps.",
      "evidence": [
        {
          "providerId": "javascript.toolchain",
          "componentId": "node",
          "evidenceId": null
        }
      ]
    }
  ]
}
